{
  "schemaVersion": "1.1",
  "runId": "46e5ee0b-550c-4371-b650-8b9600ed3387",
  "command": "pipeline",
  "mode": "pipeline-run",
  "startedAt": "<redacted>",
  "finishedAt": "<redacted>",
  "durationMs": 0,
  "discovered": [
    {
      "name": "shared",
      "path": "/tmp/gfos-ui-pack-COkLz1/2025/shared",
      "pomPath": "/tmp/gfos-ui-pack-COkLz1/2025/shared/pom.xml",
      "depth": 2
    },
    {
      "name": "web",
      "path": "/tmp/gfos-ui-pack-COkLz1/2025/web",
      "pomPath": "/tmp/gfos-ui-pack-COkLz1/2025/web/pom.xml",
      "depth": 2
    },
    {
      "name": "module-a",
      "path": "/tmp/gfos-ui-pack-COkLz1/2025/web/module-a",
      "pomPath": "/tmp/gfos-ui-pack-COkLz1/2025/web/module-a/pom.xml",
      "depth": 3,
      "parentPath": "/tmp/gfos-ui-pack-COkLz1/2025/web"
    }
  ],
  "moduleGraph": {
    "modules": [
      {
        "name": "shared",
        "path": "/tmp/gfos-ui-pack-COkLz1/2025/shared",
        "pomPath": "/tmp/gfos-ui-pack-COkLz1/2025/shared/pom.xml",
        "depth": 2
      },
      {
        "name": "web",
        "path": "/tmp/gfos-ui-pack-COkLz1/2025/web",
        "pomPath": "/tmp/gfos-ui-pack-COkLz1/2025/web/pom.xml",
        "depth": 2
      },
      {
        "name": "module-a",
        "path": "/tmp/gfos-ui-pack-COkLz1/2025/web/module-a",
        "pomPath": "/tmp/gfos-ui-pack-COkLz1/2025/web/module-a/pom.xml",
        "depth": 3,
        "parentPath": "/tmp/gfos-ui-pack-COkLz1/2025/web"
      }
    ],
    "rootModules": [
      {
        "name": "shared",
        "path": "/tmp/gfos-ui-pack-COkLz1/2025/shared",
        "pomPath": "/tmp/gfos-ui-pack-COkLz1/2025/shared/pom.xml",
        "depth": 2
      },
      {
        "name": "web",
        "path": "/tmp/gfos-ui-pack-COkLz1/2025/web",
        "pomPath": "/tmp/gfos-ui-pack-COkLz1/2025/web/pom.xml",
        "depth": 2
      }
    ]
  },
  "profileScan": {
    "enabled": false,
    "profiles": []
  },
  "buildResults": [
    {
      "repository": {
        "name": "shared",
        "path": "/tmp/gfos-ui-pack-COkLz1/2025/shared",
        "pomPath": "/tmp/gfos-ui-pack-COkLz1/2025/shared/pom.xml",
        "depth": 2
      },
      "exitCode": 0,
      "durationMs": 0,
      "mavenExecutable": "/tmp/gfos-ui-pack-COkLz1/mvn-mock.sh"
    },
    {
      "repository": {
        "name": "shared",
        "path": "/tmp/gfos-ui-pack-COkLz1/2025/shared",
        "pomPath": "/tmp/gfos-ui-pack-COkLz1/2025/shared/pom.xml",
        "depth": 2
      },
      "exitCode": 0,
      "durationMs": 0,
      "mavenExecutable": "/tmp/gfos-ui-pack-COkLz1/mvn-mock.sh"
    },
    {
      "repository": {
        "name": "web",
        "path": "/tmp/gfos-ui-pack-COkLz1/2025/web",
        "pomPath": "/tmp/gfos-ui-pack-COkLz1/2025/web/pom.xml",
        "depth": 2
      },
      "exitCode": 0,
      "durationMs": 0,
      "mavenExecutable": "/tmp/gfos-ui-pack-COkLz1/mvn-mock.sh"
    }
  ],
  "pipeline": {
    "action": "run",
    "stages": [
      {
        "stageName": "shared",
        "plan": {
          "strategy": "sequential",
          "queueStrategy": "fifo",
          "failFast": true,
          "goals": [
            "clean",
            "install"
          ],
          "mavenExecutable": "/tmp/gfos-ui-pack-COkLz1/mvn-mock.sh",
          "scope": "explicit-modules",
          "maxParallel": 1,
          "repositories": [
            {
              "name": "shared",
              "path": "/tmp/gfos-ui-pack-COkLz1/2025/shared"
            }
          ]
        },
        "buildResults": [
          {
            "repository": {
              "name": "shared",
              "path": "/tmp/gfos-ui-pack-COkLz1/2025/shared",
              "pomPath": "/tmp/gfos-ui-pack-COkLz1/2025/shared/pom.xml",
              "depth": 2
            },
            "exitCode": 0,
            "durationMs": 16,
            "mavenExecutable": "/tmp/gfos-ui-pack-COkLz1/mvn-mock.sh"
          }
        ],
        "stageDurationMs": 16,
        "estimatedSequentialDurationMs": 16,
        "speedupFactor": 1
      },
      {
        "stageName": "web",
        "plan": {
          "strategy": "parallel",
          "queueStrategy": "fifo",
          "failFast": true,
          "goals": [
            "verify"
          ],
          "mavenExecutable": "/tmp/gfos-ui-pack-COkLz1/mvn-mock.sh",
          "scope": "root-only",
          "maxParallel": 2,
          "repositories": [
            {
              "name": "shared",
              "path": "/tmp/gfos-ui-pack-COkLz1/2025/shared"
            },
            {
              "name": "web",
              "path": "/tmp/gfos-ui-pack-COkLz1/2025/web"
            }
          ]
        },
        "buildResults": [
          {
            "repository": {
              "name": "shared",
              "path": "/tmp/gfos-ui-pack-COkLz1/2025/shared",
              "pomPath": "/tmp/gfos-ui-pack-COkLz1/2025/shared/pom.xml",
              "depth": 2
            },
            "exitCode": 0,
            "durationMs": 15,
            "mavenExecutable": "/tmp/gfos-ui-pack-COkLz1/mvn-mock.sh"
          },
          {
            "repository": {
              "name": "web",
              "path": "/tmp/gfos-ui-pack-COkLz1/2025/web",
              "pomPath": "/tmp/gfos-ui-pack-COkLz1/2025/web/pom.xml",
              "depth": 2
            },
            "exitCode": 0,
            "durationMs": 15,
            "mavenExecutable": "/tmp/gfos-ui-pack-COkLz1/mvn-mock.sh"
          }
        ],
        "stageDurationMs": 16,
        "estimatedSequentialDurationMs": 30,
        "speedupFactor": 1.88
      }
    ]
  },
  "events": [
    {
      "type": "run_started",
      "timestamp": "<redacted>",
      "payload": {
        "command": "pipeline"
      }
    },
    {
      "type": "discovery_completed",
      "timestamp": "<redacted>",
      "payload": {
        "modules": 3,
        "roots": 2
      }
    },
    {
      "type": "stage_started",
      "timestamp": "<redacted>",
      "payload": {
        "stage": "shared"
      }
    },
    {
      "type": "plan_created",
      "timestamp": "<redacted>",
      "payload": {
        "stage": "shared",
        "planned": 1,
        "scope": "explicit-modules",
        "strategy": "sequential",
        "maxParallel": 1
      }
    },
    {
      "type": "module_started",
      "timestamp": "<redacted>",
      "payload": {
        "repository": "/tmp/gfos-ui-pack-COkLz1/2025/shared",
        "mavenExecutable": "/tmp/gfos-ui-pack-COkLz1/mvn-mock.sh",
        "javaHome": ""
      }
    },
    {
      "type": "module_finished",
      "timestamp": "<redacted>",
      "payload": {
        "repository": "/tmp/gfos-ui-pack-COkLz1/2025/shared",
        "exitCode": 0,
        "durationMs": 16
      }
    },
    {
      "type": "stage_finished",
      "timestamp": "<redacted>",
      "payload": {
        "stage": "shared",
        "built": 1,
        "durationMs": 16
      }
    },
    {
      "type": "stage_started",
      "timestamp": "<redacted>",
      "payload": {
        "stage": "web"
      }
    },
    {
      "type": "plan_created",
      "timestamp": "<redacted>",
      "payload": {
        "stage": "web",
        "planned": 2,
        "scope": "root-only",
        "strategy": "parallel",
        "maxParallel": 2
      }
    },
    {
      "type": "module_started",
      "timestamp": "<redacted>",
      "payload": {
        "repository": "/tmp/gfos-ui-pack-COkLz1/2025/shared",
        "mavenExecutable": "/tmp/gfos-ui-pack-COkLz1/mvn-mock.sh",
        "javaHome": ""
      }
    },
    {
      "type": "module_started",
      "timestamp": "<redacted>",
      "payload": {
        "repository": "/tmp/gfos-ui-pack-COkLz1/2025/web",
        "mavenExecutable": "/tmp/gfos-ui-pack-COkLz1/mvn-mock.sh",
        "javaHome": ""
      }
    },
    {
      "type": "module_finished",
      "timestamp": "<redacted>",
      "payload": {
        "repository": "/tmp/gfos-ui-pack-COkLz1/2025/shared",
        "exitCode": 0,
        "durationMs": 15
      }
    },
    {
      "type": "module_finished",
      "timestamp": "<redacted>",
      "payload": {
        "repository": "/tmp/gfos-ui-pack-COkLz1/2025/web",
        "exitCode": 0,
        "durationMs": 15
      }
    },
    {
      "type": "stage_finished",
      "timestamp": "<redacted>",
      "payload": {
        "stage": "web",
        "built": 2,
        "durationMs": 16
      }
    },
    {
      "type": "run_finished",
      "timestamp": "<redacted>",
      "payload": {
        "mode": "pipeline-run"
      }
    }
  ],
  "stats": {
    "discoveredCount": 3,
    "plannedCount": 3,
    "builtCount": 3,
    "succeededCount": 3,
    "failedCount": 0,
    "totalBuildDurationMs": 46,
    "failedBuildDurationMs": 0,
    "maxParallelUsed": 2,
    "profileCount": 0,
    "discoveryDurationMs": 4
  }
}