{
  "schemaVersion": "1.1",
  "runId": "4887b190-f1b3-4d85-b8b2-b3fb034f68bb",
  "command": "pipeline",
  "mode": "pipeline-plan",
  "startedAt": "<redacted>",
  "finishedAt": "<redacted>",
  "durationMs": 0,
  "discovered": [
    {
      "name": "shared",
      "path": "/tmp/gfos-ui-pack-COkLz1/2025/shared",
      "pomPath": "/tmp/gfos-ui-pack-COkLz1/2025/shared/pom.xml",
      "depth": 2
    },
    {
      "name": "web",
      "path": "/tmp/gfos-ui-pack-COkLz1/2025/web",
      "pomPath": "/tmp/gfos-ui-pack-COkLz1/2025/web/pom.xml",
      "depth": 2
    },
    {
      "name": "module-a",
      "path": "/tmp/gfos-ui-pack-COkLz1/2025/web/module-a",
      "pomPath": "/tmp/gfos-ui-pack-COkLz1/2025/web/module-a/pom.xml",
      "depth": 3,
      "parentPath": "/tmp/gfos-ui-pack-COkLz1/2025/web"
    }
  ],
  "moduleGraph": {
    "modules": [
      {
        "name": "shared",
        "path": "/tmp/gfos-ui-pack-COkLz1/2025/shared",
        "pomPath": "/tmp/gfos-ui-pack-COkLz1/2025/shared/pom.xml",
        "depth": 2
      },
      {
        "name": "web",
        "path": "/tmp/gfos-ui-pack-COkLz1/2025/web",
        "pomPath": "/tmp/gfos-ui-pack-COkLz1/2025/web/pom.xml",
        "depth": 2
      },
      {
        "name": "module-a",
        "path": "/tmp/gfos-ui-pack-COkLz1/2025/web/module-a",
        "pomPath": "/tmp/gfos-ui-pack-COkLz1/2025/web/module-a/pom.xml",
        "depth": 3,
        "parentPath": "/tmp/gfos-ui-pack-COkLz1/2025/web"
      }
    ],
    "rootModules": [
      {
        "name": "shared",
        "path": "/tmp/gfos-ui-pack-COkLz1/2025/shared",
        "pomPath": "/tmp/gfos-ui-pack-COkLz1/2025/shared/pom.xml",
        "depth": 2
      },
      {
        "name": "web",
        "path": "/tmp/gfos-ui-pack-COkLz1/2025/web",
        "pomPath": "/tmp/gfos-ui-pack-COkLz1/2025/web/pom.xml",
        "depth": 2
      }
    ]
  },
  "profileScan": {
    "enabled": false,
    "profiles": []
  },
  "buildResults": [],
  "pipeline": {
    "action": "plan",
    "stages": [
      {
        "stageName": "shared",
        "plan": {
          "strategy": "sequential",
          "queueStrategy": "fifo",
          "failFast": true,
          "goals": [
            "clean",
            "install"
          ],
          "mavenExecutable": "/tmp/gfos-ui-pack-COkLz1/mvn-mock.sh",
          "scope": "explicit-modules",
          "maxParallel": 1,
          "repositories": [
            {
              "name": "shared",
              "path": "/tmp/gfos-ui-pack-COkLz1/2025/shared"
            }
          ]
        },
        "buildResults": [],
        "stageDurationMs": 0,
        "estimatedSequentialDurationMs": 0
      },
      {
        "stageName": "web",
        "plan": {
          "strategy": "parallel",
          "queueStrategy": "fifo",
          "failFast": true,
          "goals": [
            "verify"
          ],
          "mavenExecutable": "/tmp/gfos-ui-pack-COkLz1/mvn-mock.sh",
          "scope": "root-only",
          "maxParallel": 2,
          "repositories": [
            {
              "name": "shared",
              "path": "/tmp/gfos-ui-pack-COkLz1/2025/shared"
            },
            {
              "name": "web",
              "path": "/tmp/gfos-ui-pack-COkLz1/2025/web"
            }
          ]
        },
        "buildResults": [],
        "stageDurationMs": 0,
        "estimatedSequentialDurationMs": 0
      }
    ]
  },
  "events": [
    {
      "type": "run_started",
      "timestamp": "<redacted>",
      "payload": {
        "command": "pipeline"
      }
    },
    {
      "type": "discovery_completed",
      "timestamp": "<redacted>",
      "payload": {
        "modules": 3,
        "roots": 2
      }
    },
    {
      "type": "stage_started",
      "timestamp": "<redacted>",
      "payload": {
        "stage": "shared"
      }
    },
    {
      "type": "plan_created",
      "timestamp": "<redacted>",
      "payload": {
        "stage": "shared",
        "planned": 1,
        "scope": "explicit-modules",
        "strategy": "sequential",
        "maxParallel": 1
      }
    },
    {
      "type": "stage_finished",
      "timestamp": "<redacted>",
      "payload": {
        "stage": "shared",
        "built": 0
      }
    },
    {
      "type": "stage_started",
      "timestamp": "<redacted>",
      "payload": {
        "stage": "web"
      }
    },
    {
      "type": "plan_created",
      "timestamp": "<redacted>",
      "payload": {
        "stage": "web",
        "planned": 2,
        "scope": "root-only",
        "strategy": "parallel",
        "maxParallel": 2
      }
    },
    {
      "type": "stage_finished",
      "timestamp": "<redacted>",
      "payload": {
        "stage": "web",
        "built": 0
      }
    },
    {
      "type": "run_finished",
      "timestamp": "<redacted>",
      "payload": {
        "mode": "pipeline-plan"
      }
    }
  ],
  "stats": {
    "discoveredCount": 3,
    "plannedCount": 3,
    "builtCount": 0,
    "succeededCount": 0,
    "failedCount": 0,
    "totalBuildDurationMs": 0,
    "failedBuildDurationMs": 0,
    "maxParallelUsed": 2,
    "profileCount": 0,
    "discoveryDurationMs": 2
  }
}