{
  "schemaVersion": "1.1",
  "runId": "9a1363dc-4b99-400d-a14e-9d6f09ce55e9",
  "command": "build",
  "mode": "build-plan",
  "startedAt": "<redacted>",
  "finishedAt": "<redacted>",
  "durationMs": 0,
  "discovered": [
    {
      "name": "shared",
      "path": "/tmp/gfos-ui-pack-COkLz1/2025/shared",
      "pomPath": "/tmp/gfos-ui-pack-COkLz1/2025/shared/pom.xml",
      "depth": 2
    },
    {
      "name": "web",
      "path": "/tmp/gfos-ui-pack-COkLz1/2025/web",
      "pomPath": "/tmp/gfos-ui-pack-COkLz1/2025/web/pom.xml",
      "depth": 2
    },
    {
      "name": "module-a",
      "path": "/tmp/gfos-ui-pack-COkLz1/2025/web/module-a",
      "pomPath": "/tmp/gfos-ui-pack-COkLz1/2025/web/module-a/pom.xml",
      "depth": 3,
      "parentPath": "/tmp/gfos-ui-pack-COkLz1/2025/web"
    }
  ],
  "moduleGraph": {
    "modules": [
      {
        "name": "shared",
        "path": "/tmp/gfos-ui-pack-COkLz1/2025/shared",
        "pomPath": "/tmp/gfos-ui-pack-COkLz1/2025/shared/pom.xml",
        "depth": 2
      },
      {
        "name": "web",
        "path": "/tmp/gfos-ui-pack-COkLz1/2025/web",
        "pomPath": "/tmp/gfos-ui-pack-COkLz1/2025/web/pom.xml",
        "depth": 2
      },
      {
        "name": "module-a",
        "path": "/tmp/gfos-ui-pack-COkLz1/2025/web/module-a",
        "pomPath": "/tmp/gfos-ui-pack-COkLz1/2025/web/module-a/pom.xml",
        "depth": 3,
        "parentPath": "/tmp/gfos-ui-pack-COkLz1/2025/web"
      }
    ],
    "rootModules": [
      {
        "name": "shared",
        "path": "/tmp/gfos-ui-pack-COkLz1/2025/shared",
        "pomPath": "/tmp/gfos-ui-pack-COkLz1/2025/shared/pom.xml",
        "depth": 2
      },
      {
        "name": "web",
        "path": "/tmp/gfos-ui-pack-COkLz1/2025/web",
        "pomPath": "/tmp/gfos-ui-pack-COkLz1/2025/web/pom.xml",
        "depth": 2
      }
    ]
  },
  "profileScan": {
    "enabled": false,
    "profiles": []
  },
  "buildPlan": {
    "strategy": "parallel",
    "queueStrategy": "fifo",
    "failFast": true,
    "goals": [
      "clean",
      "verify"
    ],
    "mavenExecutable": "/tmp/gfos-ui-pack-COkLz1/mvn-mock.sh",
    "scope": "root-only",
    "maxParallel": 2,
    "repositories": [
      {
        "name": "shared",
        "path": "/tmp/gfos-ui-pack-COkLz1/2025/shared"
      },
      {
        "name": "web",
        "path": "/tmp/gfos-ui-pack-COkLz1/2025/web"
      }
    ]
  },
  "buildResults": [],
  "events": [
    {
      "type": "run_started",
      "timestamp": "<redacted>",
      "payload": {
        "command": "build"
      }
    },
    {
      "type": "discovery_completed",
      "timestamp": "<redacted>",
      "payload": {
        "modules": 3,
        "roots": 2
      }
    },
    {
      "type": "plan_created",
      "timestamp": "<redacted>",
      "payload": {
        "scope": "root-only",
        "planned": 2,
        "strategy": "parallel",
        "maxParallel": 2
      }
    },
    {
      "type": "run_finished",
      "timestamp": "<redacted>",
      "payload": {
        "mode": "build-plan"
      }
    }
  ],
  "stats": {
    "discoveredCount": 3,
    "plannedCount": 2,
    "builtCount": 0,
    "succeededCount": 0,
    "failedCount": 0,
    "totalBuildDurationMs": 0,
    "failedBuildDurationMs": 0,
    "maxParallelUsed": 2,
    "profileCount": 0,
    "discoveryDurationMs": 2
  }
}